CVE_ID,CVE_Description,Labels,Ignored_Labels,Remained_Labels
CVE-2018-18460,XSS exists in the wp-live-chat-support v8.0.15 plugin for WordPress via the modules/gdpr.php term parameter in a wp-admin/admin.php wplivechat-menu-gdpr-page request.,"['T1082', 'T1217', 'T1592', 'T1595']",[],"['T1082', 'T1217', 'T1592', 'T1595']"
CVE-2018-18461,The Arigato Autoresponder and Newsletter (aka bft-autoresponder) v2.5.1.7 plugin for WordPress allows remote attackers to execute arbitrary code via PHP code in attachments[] data to models/attachment.php.,"['T1027.006', 'T1027.009', 'T1564.009', 'T1001.002', 'T1027.003', 'T1027.004', 'T1218.001', 'T1221', 'T1036.003']",[],"['T1027.006', 'T1027.009', 'T1564.009', 'T1001.002', 'T1027.003', 'T1027.004', 'T1218.001', 'T1221', 'T1036.003']"
CVE-2018-18467,An issue was discovered in Daniel Gultsch Conversations 2.3.4. It is possible to spoof a custom message to an existing opened conversation by sending an intent.,"['T1562.003', 'T1574.006', 'T1574.007', 'T1217', 'T1592', 'T1595', 'T1018', 'T1046', 'T1016', 'T1049', 'T1590', 'T1124', 'T1592.002', 'T1082', 'T1083', 'T1111', 'T1057', 'T1007', 'T1087', 'T1069', 'T1615', 'T1033', 'T1134.002', 'T1134.003', 'T1606', 'T1134', 'T1528', 'T1539', 'T1134.001', 'T1550.004', 'T1185', 'T1550.001', 'T1563', 'T1036.005', 'T1135', 'T1120', 'T1027']",[],"['T1562.003', 'T1574.006', 'T1574.007', 'T1217', 'T1592', 'T1595', 'T1018', 'T1046', 'T1016', 'T1049', 'T1590', 'T1124', 'T1592.002', 'T1082', 'T1083', 'T1111', 'T1057', 'T1007', 'T1087', 'T1069', 'T1615', 'T1033', 'T1134.002', 'T1134.003', 'T1606', 'T1134', 'T1528', 'T1539', 'T1134.001', 'T1550.004', 'T1185', 'T1550.001', 'T1563', 'T1036.005', 'T1135', 'T1120', 'T1027']"
CVE-2018-1847,"IBM Financial Transaction Manager (FTM) for Multi-Platform (MP) v2.0.0.0 through 2.0.0.5, v2.1.0.0 through 2.1.0.4, v2.1.1.0 through 2.1.1.4, and v3.0.0.0 through 3.0.0.8 could allow a remote attacker to traverse directories on the system. An attacker could send a specially-crafted URL request containing ""dot dot"" sequences (/../) to view arbitrary files on the system. IBM X-Force ID: 150946.",['T1027'],[],['T1027']
CVE-2018-18471,"/api/2.0/rest/aggregator/xml in Axentra firmware, used by NETGEAR Stora, Seagate GoFlex Home, and MEDION LifeCloud, has an XXE vulnerability that can be chained with an SSRF bug to gain remote command execution as root. It can be triggered by anyone who knows the IP address of the affected device.",['T1499.003'],[],['T1499.003']
CVE-2018-18472,"Western Digital WD My Book Live and WD My Book Live Duo (all versions) have a root Remote Command Execution bug via shell metacharacters in the /api/1.0/rest/language_configuration language parameter. It can be triggered by anyone who knows the IP address of the affected device, as exploited in the wild in June 2021 for factory reset commands,",['T1027'],[],['T1027']
CVE-2018-18473,"A hidden backdoor on PATLITE NH-FB Series devices with firmware version 1.45 or earlier, NH-FV Series devices with firmware version 1.10 or earlier, and NBM Series devices with firmware version 1.09 or earlier allow attackers to enable an SSH daemon via the ""kankichi"" or ""kamiyo4"" password to the _secret1.htm URI. Subsequently, the default password of root for the root account allows an attacker to conduct remote code execution and as a result take over the system.","['T1552.001', 'T1078.001', 'T1110.001', 'T1110']",[],"['T1552.001', 'T1078.001', 'T1110.001', 'T1110']"
CVE-2018-18475,Zoho ManageEngine OpManager before 12.3 build 123214 allows Unrestricted Arbitrary File Upload.,"['T1574.010', 'T1548']",[],"['T1574.010', 'T1548']"
CVE-2018-18478,"Persistent Cross-Site Scripting (XSS) issues in LibreNMS before 1.44 allow remote attackers to inject arbitrary web script or HTML via the dashboard_name parameter in the /ajax_form.php resource, related to html/includes/forms/add-dashboard.inc.php, html/includes/forms/delete-dashboard.inc.php, and html/includes/forms/edit-dashboard.inc.php.","['T1082', 'T1217', 'T1592', 'T1595']",[],"['T1082', 'T1217', 'T1592', 'T1595']"
CVE-2018-18547,"Vesta Control Panel through 0.9.8-22 has XSS via the edit/web/ domain parameter, the list/backup/ backup parameter, the list/rrd/ period parameter, the list/directory/ dir_a parameter, or the filename to the list/directory/ URI.","['T1082', 'T1217', 'T1592', 'T1595']",[],"['T1082', 'T1217', 'T1592', 'T1595']"
CVE-2018-18548,ajenticp (aka Ajenti Docker control panel) for Ajenti through v1.2.23.13 has XSS via a filename that is mishandled in File Manager.,"['T1082', 'T1217', 'T1592', 'T1595']",[],"['T1082', 'T1217', 'T1592', 'T1595']"
CVE-2018-18551,"ServersCheck Monitoring Software through 14.3.3 has Persistent and Reflected XSS via the sensors.html status parameter, sensors.html type parameter, sensors.html device parameter, report.html location parameter, group_delete.html group parameter, report_save.html query parameter, sensors.html location parameter, or group_delete.html group parameter.","['T1082', 'T1217', 'T1592', 'T1595']",[],"['T1082', 'T1217', 'T1592', 'T1595']"
CVE-2018-1857,"IBM DB2 for Linux, UNIX and Windows (includes DB2 Connect Server) 11.1 could allow a user to bypass FGAC control and gain access to data they shouldn't be able to see. IBM X-Force ID: 151155.","['T1562.003', 'T1574.006', 'T1574.007', 'T1217', 'T1592', 'T1595', 'T1018', 'T1046', 'T1016', 'T1049', 'T1590', 'T1124', 'T1592.002', 'T1082', 'T1083', 'T1111', 'T1057', 'T1007', 'T1087', 'T1069', 'T1615', 'T1033', 'T1134.002', 'T1134.003', 'T1606', 'T1134', 'T1528', 'T1539', 'T1134.001', 'T1550.004', 'T1185', 'T1550.001', 'T1563', 'T1036.005', 'T1135', 'T1120', 'T1027']",[],"['T1562.003', 'T1574.006', 'T1574.007', 'T1217', 'T1592', 'T1595', 'T1018', 'T1046', 'T1016', 'T1049', 'T1590', 'T1124', 'T1592.002', 'T1082', 'T1083', 'T1111', 'T1057', 'T1007', 'T1087', 'T1069', 'T1615', 'T1033', 'T1134.002', 'T1134.003', 'T1606', 'T1134', 'T1528', 'T1539', 'T1134.001', 'T1550.004', 'T1185', 'T1550.001', 'T1563', 'T1036.005', 'T1135', 'T1120', 'T1027']"
CVE-2018-18570,Planon before Live Build 41 has XSS.,"['T1082', 'T1217', 'T1592', 'T1595']",[],"['T1082', 'T1217', 'T1592', 'T1595']"
CVE-2018-18571,An Incorrect Access Control vulnerability has been identified in Citrix XenMobile Server 10.8.0 before Rolling Patch 6 and 10.9.0 before Rolling Patch 3. An attacker can impersonate and take actions on behalf of any Mobile Application Management (MAM) enrolled device.,"['T1548', 'T1040', 'T1185', 'T1550.001', 'T1563', 'T1134', 'T1528', 'T1539', 'T1505.003', 'T1574.005', 'T1574.010', 'T1557']",[],"['T1548', 'T1040', 'T1185', 'T1550.001', 'T1563', 'T1134', 'T1528', 'T1539', 'T1505.003', 'T1574.005', 'T1574.010', 'T1557']"
CVE-2018-18572,"osCommerce 2.3.4.1 has an incomplete '.htaccess' for blacklist filtering in the ""product"" page. Because of this filter, script files with certain PHP-related extensions (such as .phtml and .php5) didn't execute in the application. But this filter didn't prevent the '.pht' extension. Thus, remote authenticated administrators can upload '.pht' files for arbitrary PHP code execution via a /catalog/admin/categories.php?cPath=&action=new_product URI.","['T1574.010', 'T1548']",[],"['T1574.010', 'T1548']"
CVE-2018-18573,"osCommerce 2.3.4.1 has an incomplete '.htaccess' for blacklist filtering in the ""product"" page. Remote authenticated administrators can upload new '.htaccess' files (e.g., omitting .php) and subsequently achieve arbitrary PHP code execution via a /catalog/admin/categories.php?cPath=&action=new_product URI.","['T1027.006', 'T1027.009', 'T1564.009', 'T1001.002', 'T1027.003', 'T1027.004', 'T1218.001', 'T1221', 'T1036.003']",[],"['T1027.006', 'T1027.009', 'T1564.009', 'T1001.002', 'T1027.003', 'T1027.004', 'T1218.001', 'T1221', 'T1036.003']"
CVE-2018-18576,The Hustle (aka wordpress-popup) plugin through 6.0.5 for WordPress allows Directory Traversal to obtain a directory listing via the views/admin/dashboard/ URI.,['T1027'],[],['T1027']
CVE-2018-18578,DedeCMS 5.7 SP2 allows XSS via the plus/qrcode.php type parameter.,"['T1082', 'T1217', 'T1592', 'T1595']",[],"['T1082', 'T1217', 'T1592', 'T1595']"
CVE-2018-18579,Reflected XSS exists in DedeCMS 5.7 SP2 via the /member/pm.php folder parameter.,"['T1082', 'T1217', 'T1592', 'T1595']",[],"['T1082', 'T1217', 'T1592', 'T1595']"
CVE-2018-1858,IBM API Connect 5.0.0.0 through 5.0.8.6 is vulnerable to cross-site request forgery which could allow an attacker to execute malicious and unauthorized actions transmitted from a user that the website trusts. IBM X-Force ID: 151256.,"['T1134', 'T1528', 'T1539']",[],"['T1134', 'T1528', 'T1539']"
CVE-2018-18586,"chmextract.c in the chmextract sample program, as distributed with libmspack before 0.8alpha, does not protect against absolute/relative pathnames in CHM files, leading to Directory Traversal. NOTE: the vendor disputes that this is a libmspack vulnerability, because chmextract.c was only intended as a source-code example, not a supported application",['T1027'],[],['T1027']
CVE-2018-18587,BigProf AppGini 5.70 stores the passwords in the database using the MD5 hash.,"['T1110', 'T1036.001', 'T1553.002', 'T1195.002']",[],"['T1110', 'T1036.001', 'T1553.002', 'T1195.002']"
CVE-2018-18590,"A potential remote code execution and information disclosure vulnerability exists in Micro Focus Operations Bridge containerized suite versions 2017.11, 2018.02, 2018.05, 2018.08. This vulnerability could allow for information disclosure.","['T1562.003', 'T1574.006', 'T1574.007', 'T1217', 'T1592', 'T1595', 'T1018', 'T1046', 'T1016', 'T1049', 'T1590', 'T1124', 'T1592.002', 'T1082', 'T1083', 'T1111', 'T1057', 'T1007', 'T1087', 'T1069', 'T1615', 'T1033', 'T1134.002', 'T1134.003', 'T1606', 'T1134', 'T1528', 'T1539', 'T1134.001', 'T1550.004', 'T1185', 'T1550.001', 'T1563', 'T1036.005', 'T1135', 'T1120', 'T1027']",[],"['T1562.003', 'T1574.006', 'T1574.007', 'T1217', 'T1592', 'T1595', 'T1018', 'T1046', 'T1016', 'T1049', 'T1590', 'T1124', 'T1592.002', 'T1082', 'T1083', 'T1111', 'T1057', 'T1007', 'T1087', 'T1069', 'T1615', 'T1033', 'T1134.002', 'T1134.003', 'T1606', 'T1134', 'T1528', 'T1539', 'T1134.001', 'T1550.004', 'T1185', 'T1550.001', 'T1563', 'T1036.005', 'T1135', 'T1120', 'T1027']"
CVE-2020-7505,A CWE-20: Improper Input Validation vulnerability exists in Easergy T300 (Firmware version 1.5.2 and older) which could allow an attacker to disable the webserver service on the device when specially crafted network packets are sent.,"['T1548', 'T1027', 'T1562.003', 'T1574.006', 'T1574.007', 'T1499.003', 'T1539', 'T1036.001', 'T1553.002', 'T1036.003', 'T1070', 'T1562.002', 'T1562.008', 'T1082', 'T1217', 'T1592', 'T1595']",[],"['T1548', 'T1027', 'T1562.003', 'T1574.006', 'T1574.007', 'T1499.003', 'T1539', 'T1036.001', 'T1553.002', 'T1036.003', 'T1070', 'T1562.002', 'T1562.008', 'T1082', 'T1217', 'T1592', 'T1595']"
CVE-2020-7506,A CWE-494 Download of Code Without Integrity Check vulnerability exists in Easergy T300 (Firmware version 1.5.2 and older) which could allow an attacker to inject data with dangerous content into the firmware and execute arbitrary code on the system.,"['T1195.002', 'T1072', 'T1195.001', 'T1195', 'T1185', 'T1557', 'T1036.005']","['T1072', 'T1195.001']","['T1195.002', 'T1195', 'T1185', 'T1557', 'T1036.005']"
CVE-2020-7507,"A CWE-200: Information Exposure vulnerability exists in Easergy T300, Firmware V1.5.2 and prior, which could allow an attacker to pack or unpack the archive with the firmware for the controller and modules using the usual tar archiver resulting in an information exposure.","['T1562.003', 'T1574.006', 'T1574.007', 'T1217', 'T1592', 'T1595', 'T1018', 'T1046', 'T1016', 'T1049', 'T1590', 'T1124', 'T1592.002', 'T1082', 'T1083', 'T1111', 'T1057', 'T1007', 'T1087', 'T1069', 'T1615', 'T1033', 'T1134.002', 'T1134.003', 'T1606', 'T1134', 'T1528', 'T1539', 'T1134.001', 'T1550.004', 'T1185', 'T1550.001', 'T1563', 'T1036.005', 'T1135', 'T1120', 'T1027']",[],"['T1562.003', 'T1574.006', 'T1574.007', 'T1217', 'T1592', 'T1595', 'T1018', 'T1046', 'T1016', 'T1049', 'T1590', 'T1124', 'T1592.002', 'T1082', 'T1083', 'T1111', 'T1057', 'T1007', 'T1087', 'T1069', 'T1615', 'T1033', 'T1134.002', 'T1134.003', 'T1606', 'T1134', 'T1528', 'T1539', 'T1134.001', 'T1550.004', 'T1185', 'T1550.001', 'T1563', 'T1036.005', 'T1135', 'T1120', 'T1027']"
CVE-2020-7508,A CWE-400: Uncontrolled Resource Consumption vulnerability exists in Easergy T300 (Firmware version 1.5.2 and older) which could allow an attacker to login multiple times resulting in a denial of service.,"['T1499.002', 'T1498.001', 'T1499', 'T1499.003']",[],"['T1499.002', 'T1498.001', 'T1499', 'T1499.003']"
CVE-2020-7509,A CWE-307 Improper Restriction of Excessive Authentication Attempts vulnerability exists in Easergy T300 (Firmware version 1.5.2 and older) which could allow an attacker to gain full access by brute force.,"['T1110.001', 'T1110', 'T1078', 'T1110.003', 'T1110.004', 'T1558']",[],"['T1110.001', 'T1110', 'T1078', 'T1110.003', 'T1110.004', 'T1558']"
CVE-2020-7510,A CWE-269: Improper privilege management (write) vulnerability exists in Easergy T300 (Firmware version 1.5.2 and older) which could allow an attacker to elevate their privileges and delete files.,"['T1548', 'T1574.010']",[],"['T1548', 'T1574.010']"
CVE-2020-7511,A CWE-200: Information Exposure vulnerability exists in Easergy T300 (Firmware version 1.5.2 and older) which could allow attacker to obtain private keys.,"['T1562.003', 'T1574.006', 'T1574.007', 'T1217', 'T1592', 'T1595', 'T1018', 'T1046', 'T1016', 'T1049', 'T1590', 'T1124', 'T1592.002', 'T1082', 'T1083', 'T1111', 'T1057', 'T1007', 'T1087', 'T1069', 'T1615', 'T1033', 'T1134.002', 'T1134.003', 'T1606', 'T1134', 'T1528', 'T1539', 'T1134.001', 'T1550.004', 'T1185', 'T1550.001', 'T1563', 'T1036.005', 'T1135', 'T1120', 'T1027']",[],"['T1562.003', 'T1574.006', 'T1574.007', 'T1217', 'T1592', 'T1595', 'T1018', 'T1046', 'T1016', 'T1049', 'T1590', 'T1124', 'T1592.002', 'T1082', 'T1083', 'T1111', 'T1057', 'T1007', 'T1087', 'T1069', 'T1615', 'T1033', 'T1134.002', 'T1134.003', 'T1606', 'T1134', 'T1528', 'T1539', 'T1134.001', 'T1550.004', 'T1185', 'T1550.001', 'T1563', 'T1036.005', 'T1135', 'T1120', 'T1027']"
CVE-2020-7513,A CWE-327: Use of a Broken or Risky Cryptographic Algorithm vulnerability exists in Easergy T300 (Firmware version 1.5.2 and older) which could allow an attacker to acquire a password by brute force.,"['T1110', 'T1036.001', 'T1553.002', 'T1195.002']",[],"['T1110', 'T1036.001', 'T1553.002', 'T1195.002']"
CVE-2020-7514,A CWE-312: Cleartext Storage of Sensitive Information vulnerability exists in Easergy T300 (Firmware version 1.5.2 and older) which could allow an attacker to intercept traffic and read configuration data.,"['T1005', 'T1552.004']",[],"['T1005', 'T1552.004']"
CVE-2020-7515,A CWE-327: Use of a Broken or Risky Cryptographic Algorithm vulnerability exists in Easergy Builder (Version 1.4.7.2 and older) which could allow an attacker access to the authorization credentials for a device and gain full access.,"['T1110', 'T1036.001', 'T1553.002', 'T1195.002']",[],"['T1110', 'T1036.001', 'T1553.002', 'T1195.002']"
CVE-2020-7516,A CWE-321: Use of hard-coded cryptographic key stored in cleartext vulnerability exists in Easergy Builder V1.4.7.2 and prior which could allow an attacker to decrypt a password.,"['T1552.001', 'T1078.001', 'T1110.001', 'T1110']",[],"['T1552.001', 'T1078.001', 'T1110.001', 'T1110']"
CVE-2020-7517,A CWE-316: Cleartext Storage of Sensitive Information in Memory vulnerability exists in Easergy Builder V1.4.7.2 and prior which could allow an attacker access to login credentials.,"['T1005', 'T1552.004']",[],"['T1005', 'T1552.004']"
CVE-2020-7518,A CWE-312: Cleartext Storage of Sensitive Information vulnerability exists in Easergy Builder (Version 1.4.7.2 and older) which could allow an attacker to read user credentials.,"['T1005', 'T1552.004']",[],"['T1005', 'T1552.004']"
CVE-2020-7519,A CWE-20: Improper input validation vulnerability exists in Easergy Builder (Version 1.4.7.2 and older) which could allow an attacker to modify project configuration files.,"['T1548', 'T1027', 'T1562.003', 'T1574.006', 'T1574.007', 'T1499.003', 'T1539', 'T1036.001', 'T1553.002', 'T1036.003', 'T1070', 'T1562.002', 'T1562.008', 'T1082', 'T1217', 'T1592', 'T1595']",[],"['T1548', 'T1027', 'T1562.003', 'T1574.006', 'T1574.007', 'T1499.003', 'T1539', 'T1036.001', 'T1553.002', 'T1036.003', 'T1070', 'T1562.002', 'T1562.008', 'T1082', 'T1217', 'T1592', 'T1595']"
CVE-2020-7521,A CWE-521: Weak Password Requirements vulnerability exists in Easergy Builder (Version 1.4.7.2 and older) which could allow an attacker to compromise a user account.,"['T1110', 'T1110.001', 'T1558.003', 'T1558', 'T1078', 'T1110.002', 'T1021', 'T1114.002', 'T1133', 'T1021.002', 'T1110.003', 'T1078.001']",[],"['T1110', 'T1110.001', 'T1558.003', 'T1558', 'T1078', 'T1110.002', 'T1021', 'T1114.002', 'T1133', 'T1021.002', 'T1110.003', 'T1078.001']"
CVE-2020-7540,"A CWE-22: Improper Limitation of a Pathname to a Restricted Directory ('Path Traversal' Vulnerability Type) vulnerability exists in the Web Server on Modicon M340, Legacy Offers Modicon Quantum and Modicon Premium and associated Communication Modules (see security notification for affected versions), that could cause disclosure of information when sending a specially crafted request to the controller over HTTP.",['T1027'],[],['T1027']
CVE-2020-7541,"A CWE-306: Missing Authentication for Critical Function vulnerability exists in the Web Server on Modicon M340, Legacy Offers Modicon Quantum and Modicon Premium and associated Communication Modules (see security notification for affected versions), that could cause unauthenticated command execution in the controller when sending special HTTP requests.","['T1134', 'T1528', 'T1539']",[],"['T1134', 'T1528', 'T1539']"
CVE-2020-7544,"A CWE-425: Direct Request ('Forced Browsing') vulnerability exists in the Web Server on Modicon M340, Legacy Offers Modicon Quantum and Modicon Premium and associated Communication Modules (see security notification for affected versions), that could cause disclosure of sensitive data when sending a specially crafted request to the controller over HTTP.","['T1083', 'T1003', 'T1119', 'T1213', 'T1530', 'T1555', 'T1602', 'T1565.002', 'T1548']",[],"['T1083', 'T1003', 'T1119', 'T1213', 'T1530', 'T1555', 'T1602', 'T1565.002', 'T1548']"
CVE-2020-7546,A CWE-269 Improper Privilege Management vulnerability exists in EcoStruxureª Operator Terminal Expert runtime (Vijeo XD) that could cause privilege escalation on the workstation when interacting directly with a driver installed by the runtime software of EcoStruxureª Operator Terminal Expert.,"['T1548', 'T1574.010']",[],"['T1548', 'T1574.010']"
CVE-2020-7548,A CWE-79: Improper Neutralization of Input During Web Page Generation vulnerability exists in EcoStruxureª and SmartStruxureª Power Monitoring and SCADA Software (see security notification for version information) that could allow an attacker to perform actions on behalf of the authorized user when accessing an affected webpage.,"['T1082', 'T1217', 'T1592', 'T1595']",[],"['T1082', 'T1217', 'T1592', 'T1595']"
CVE-2020-7561,"A CWE-330 - Use of Insufficiently Random Values vulnerability exists in Smartlink, PowerTag, and Wiser Series Gateways (see security notification for version information) that could allow unauthorized users to login.","['T1110', 'T1552.004', 'T1036.001', 'T1553.002', 'T1134.002', 'T1134.003', 'T1606', 'T1134', 'T1528', 'T1539']",[],"['T1110', 'T1552.004', 'T1036.001', 'T1553.002', 'T1134.002', 'T1134.003', 'T1606', 'T1134', 'T1528', 'T1539']"
CVE-2020-7565,"A CWE-306: Missing Authentication for Critical Function vulnerability exists in Easergy T300 (with firmware 2.7 and older) that could cause a wide range of problems, including information exposure, denial of service, and command execution when access to a resource from an attacker is not restricted or incorrectly restricted.","['T1027.009', 'T1546.004', 'T1546.016', 'T1574.011', 'T1543.003', 'T1112', 'T1647', 'T1553.004', 'T1036.001', 'T1553.002', 'T1491', 'T1548', 'T1005', 'T1555.001', 'T1543', 'T1587.001', 'T1027', 'T1014', 'T1542.003', 'T1547.006', 'T1546.001', 'T1505.005', 'T1546.008', 'T1080', 'T1574.005', 'T1574.010', 'T1037', 'T1543.001', 'T1543.004', 'T1547', 'T1556.006', 'T1562.001', 'T1562.002', 'T1562.004', 'T1562.007', 'T1562.008', 'T1562.009']",[],"['T1027.009', 'T1546.004', 'T1546.016', 'T1574.011', 'T1543.003', 'T1112', 'T1647', 'T1553.004', 'T1036.001', 'T1553.002', 'T1491', 'T1548', 'T1005', 'T1555.001', 'T1543', 'T1587.001', 'T1027', 'T1014', 'T1542.003', 'T1547.006', 'T1546.001', 'T1505.005', 'T1546.008', 'T1080', 'T1574.005', 'T1574.010', 'T1037', 'T1543.001', 'T1543.004', 'T1547', 'T1556.006', 'T1562.001', 'T1562.002', 'T1562.004', 'T1562.007', 'T1562.008', 'T1562.009']"
CVE-2020-7567,"A CWE-326: Inadequate Encryption Strength vulnerability exists in Modicon M221 (all references, all versions) that could allow the attacker to break the encryption key when the attacker has captured the traffic between EcoStruxure Machine - Basic software and Modicon M221 controller.",['T1110'],[],['T1110']
CVE-2020-7568,"A CWE-311: Missing Encryption of Sensitive Data vulnerability exists in Modicon M221 (all references, all versions) that could allow the attacker to find the password hash when the attacker has captured the traffic between EcoStruxure Machine - Basic software and Modicon M221 controller and broke the encryption keys.","['T1040', 'T1111', 'T1005', 'T1539', 'T1552.004', 'T1056.004', 'T1589', 'T1557', 'T1036.001', 'T1553.002']",[],"['T1040', 'T1111', 'T1005', 'T1539', 'T1552.004', 'T1056.004', 'T1589', 'T1557', 'T1036.001', 'T1553.002']"
CVE-2020-7569,"A CWE-200: Exposure of Sensitive Information to an Unauthorized Actor vulnerability exists in Modicon M221 (all references, all versions) that could allow non sensitive information disclosure when the attacker has captured the traffic between EcoStruxure Machine - Basic software and Modicon M221 controller.","['T1562.003', 'T1574.006', 'T1574.007', 'T1217', 'T1592', 'T1595', 'T1018', 'T1046', 'T1016', 'T1049', 'T1590', 'T1124', 'T1592.002', 'T1082', 'T1083', 'T1111', 'T1057', 'T1007', 'T1087', 'T1069', 'T1615', 'T1033', 'T1134.002', 'T1134.003', 'T1606', 'T1134', 'T1528', 'T1539', 'T1134.001', 'T1550.004', 'T1185', 'T1550.001', 'T1563', 'T1036.005', 'T1135', 'T1120', 'T1027']",[],"['T1562.003', 'T1574.006', 'T1574.007', 'T1217', 'T1592', 'T1595', 'T1018', 'T1046', 'T1016', 'T1049', 'T1590', 'T1124', 'T1592.002', 'T1082', 'T1083', 'T1111', 'T1057', 'T1007', 'T1087', 'T1069', 'T1615', 'T1033', 'T1134.002', 'T1134.003', 'T1606', 'T1134', 'T1528', 'T1539', 'T1134.001', 'T1550.004', 'T1185', 'T1550.001', 'T1563', 'T1036.005', 'T1135', 'T1120', 'T1027']"
CVE-2020-7570,A CWE-434 Unrestricted Upload of File with Dangerous Type vulnerability exists in EcoStruxure Building Operation WebReports V1.9 - V3.1 that could cause an authenticated remote user being able to upload arbitrary files due to incorrect verification of user supplied files and achieve remote code execution.,"['T1574.010', 'T1548']",[],"['T1574.010', 'T1548']"
CVE-2020-7571,A CWE-79 Improper Neutralization of Input During Web Page Generation (Cross-site Scripting Stored) vulnerability exists in EcoStruxure Building Operation WebReports V1.9 - V3.1 that could cause an authenticated remote user being able to inject arbitrary web script or HTML due to incorrect sanitization of user-supplied data and achieve a Cross-Site Scripting stored attack against other WebReport users.,"['T1082', 'T1217', 'T1592', 'T1595']",[],"['T1082', 'T1217', 'T1592', 'T1595']"
CVE-2020-7572,A CWE-79 Multiple Improper Neutralization of Input During Web Page Generation (Cross-site Scripting Reflected) vulnerability exists in EcoStruxure Building Operation WebReports V1.9 - V3.1 that could cause a remote attacker to inject arbitrary web script or HTML due to incorrect sanitization of user supplied data and achieve a Cross-Site Scripting reflected attack against other WebReport users.,"['T1082', 'T1217', 'T1592', 'T1595']",[],"['T1082', 'T1217', 'T1592', 'T1595']"
CVE-2020-7574,"A CWE-611 Improper Restriction of XML External Entity Reference vulnerability exists in EcoStruxure Building Operation WebReports V1.9 - V3.1 that could cause an authenticated remote user being able to inject arbitrary XML code and obtain disclosure of confidential data, denial of service, server side request forgery due to improper configuration of the XML parser.",['T1499.003'],[],['T1499.003']
CVE-2020-7575,"A vulnerability has been identified in Climatix POL908 (BACnet/IP module) (All versions), Climatix POL909 (AWM module) (All versions < V11.32). A persistent cross-site scripting (XSS) vulnerability exists in the ""Server Config"" web interface of the affected devices that could allow an attacker to inject arbitrary JavaScript code. The code could be potentially executed later by another (possibly privileged) user. The security vulnerability could be exploited by an attacker with network access to the affected system. Successful exploitation requires no system privileges. An attacker could use the vulnerability to compromise the confidentiality and integrity of other users' web session.","['T1082', 'T1217', 'T1592', 'T1595']",[],"['T1082', 'T1217', 'T1592', 'T1595']"
